"module","original_risk_score","observed_issues","updated_risk_score","justification","evidence"
"Catalog/Public (R2)","16","P2-UI-CAT-004 failed with HTTP 500 on /news; gate P2-QG-004 failed","20","Likelihood increased due production-facing 5xx; impact remains high for public discovery journey","qa/phase2/metrics/phase2-test-execution-log.csv;qa/phase2/metrics/phase2-quality-gate-results.csv"
"Integration API (R4,R6)","10","P2-API-INT-001 and P2-API-INT-002 failed (404); gate P2-QG-001 failed","20","Repeated integration boundary failures on critical external interface increase both likelihood and business impact","qa/phase2/metrics/phase2-test-execution-log.csv;qa/phase2/metrics/phase2-defects-vs-risk.csv"
"Circulation/Operations (R3)","15","Ops guard expectation mismatch surfaced; module coverage 66.7% (<70%)","18","Coverage gap lowers detectability while operations remain critical to lending continuity","qa/phase2/metrics/phase2-defects-vs-risk.csv;qa/phase2/metrics/phase2-automation-coverage.csv"
"Admin Operations (R5)","8","Admin guard path failed in API smoke with 404; coverage 50%","15","Admin workflow instability and low automation depth increase operational risk substantially","qa/phase2/metrics/phase2-test-execution-log.csv;qa/phase2/metrics/phase2-automation-coverage.csv"
"Coverage Readiness (R13)","16","Coverage driver unavailable in measured local environment (blocked)","18","Low observability reduces defect detectability and delays confident risk closure","qa/phase2/evidence/logs/phase2-coverage.log;qa/phase2/metrics/phase2-quality-gate-results.csv"
