"aspect","planned_phase1","actual_phase2_midterm","gap","interpretation","next_action"
"Catalog public stability","High risk (R2 score 16), expect robust smoke coverage and no 5xx","Coverage 87.5 percent but /news failed with HTTP 500","Runtime reliability gap despite broad coverage","Coverage breadth did not guarantee production stability","Add route-level diagnostics and enforce 0 public 5xx in CI"
"Integration boundary/API contract","R4/R6 medium risk with middleware-based protection","Two integration smoke failures with 404 outcomes; new midterm integration tests pass for boundary validation","Contract-path instability persists beyond boundary middleware","Core boundary checks are strong, downstream route/data paths remain fragile","Stabilize integration endpoint routing/data shape and add CI contract checks"
"Circulation and admin operations","Critical operations with strong guard expectations","One circulation/admin guard mismatch and low admin/circulation coverage (50-66.7%)","Detectability and depth insufficient for high-impact workflows","High-impact modules need deeper scenario coverage","Increase admin/circulation automated checks beyond 70 percent"
"Coverage observability","R13 score 16 with coverage reporting expected","Local coverage driver blocked; CI coverage exists but local reproducibility reduced","Measurement parity across environments missing","Tooling gap impacts confidence and defect detectability","Standardize coverage tooling across local and CI"
"Automation depth by level","Multi-level testing strategy envisioned","Midterm added 8 tests across Unit/Integration/E2E with evidence logs","Some concurrency/flakiness dimensions still under-sampled","Progress achieved, but repeated-run stability dataset is still limited","Introduce scheduled reruns and flaky-rate tracking"
